{"gate":"CODE_GATE","verdict":"VETO","summary":"Second CODE_GATE audit after the recorded REVISE_ONCE still finds an unmet mandatory criterion. The implementation continues to separate source training/decomposition from target evaluation and implements the declared objectives/accounting paths, but the frozen contract's source-only lambda-selection discipline remains neither implemented nor tested. Because docs/audits/LATENT-001-CODE_GATE-20260905T080917Z.json already recorded a CODE_GATE REVISE_ONCE, this repeated CODE_GATE failure is a VETO under the supervisor rules.","checks":[{"criterion":"1. Implemented objectives match their declared definitions.","status":"PASS","evidence":"docs/experiments/LATENT-001_contract.md:63-70 declares source MSE plus lambda-weighted L1/L2, scalar-scale IRMv1, Gaussian-RBF MMD, CORAL, shared-head gradient alignment, and shared-head Hessian alignment. src/ood_repr_reg/latent_semantic.py:315-355 implements branches for erm, l1, l2, mmd, coral, irmv1, grad_align, and hess_align; src/ood_repr_reg/latent_semantic.py:358-394 trains objective = mean_source_risk + strength * penalty. tests/test_latent_semantic.py:102-166 now checks these formulas against direct calculations."},{"criterion":"2. Target data cannot flow into training, lambda choice, whitening, operators, projectors, or semantic labels.","status":"UNCLEAR","evidence":"src/ood_repr_reg/run_latent_audit.py:45-84 constructs sources and targets separately, trains only on train_batches from sources, and fits semantic decomposition only on semantic_a/semantic_b source batches. src/ood_repr_reg/latent_semantic.py:397-410 whitens encoded estimator batches only, and src/ood_repr_reg/latent_semantic.py:459-484 estimates semantic raw bases from batch designs and source moments. However, no lambda-selection implementation exists: run_latent_audit.py:65-67 simply enumerates ERM strength 0.0 or configured strengths, so the contract requirement that lambda be selected solely by source risk plus the source objective is not executable or testable."},{"criterion":"3. ERM pairing uses the same seed/data/capacity and target risk is evaluated without retraining.","status":"PASS","evidence":"src/ood_repr_reg/run_latent_audit.py:57-77 creates one seed-specific train_batches object, reuses it across methods/strengths for a given seed, passes the same latent_dim and initialization seed into train_model, and uses strength 0.0 for ERM. src/ood_repr_reg/run_latent_audit.py:126-143 computes bounds and target risk accounting after model training/decomposition; src/ood_repr_reg/latent_semantic.py:754-803 performs fixed-model component risk accounting and contains no retraining path. tests/test_run_latent_audit.py:18-66 monkeypatches runner calls to assert source-only batches, shared batch identity, same seed/capacity pairing, and post-training target accounting."},{"criterion":"4. Bound budgets are configured independently of evaluated targets.","status":"PASS","evidence":"configs/latent_001_main.json defines intervention_budget independently of target rows. src/ood_repr_reg/run_latent_audit.py:126-128 computes conservative_component_bound before iterating over targets at lines 129-143. src/ood_repr_reg/latent_semantic.py:806-850 computes the bound from SCM/source moments, configured relation/mean/covariance budgets, model/decomposition quantities, and returns NO OMEGA-TO-COMPONENT BOUND rather than fitting an evaluated-target budget. tests/test_latent_semantic.py:223-232 checks repeatability and coverage over frozen targets, though it does not mutate target cases to prove target-set independence directly."},{"criterion":"5. Tests cover all requirements in the frozen contract.","status":"FAIL","evidence":"The previous CODE_GATE audit explicitly required repairs for runner dataflow, ERM pairing, objective identities, independent bound budgets, and A/B fold exchange. Current tests added coverage for many of these: tests/test_run_latent_audit.py:8-66 covers source-only runner flow and ERM pairing; tests/test_latent_semantic.py:102-166 covers objective identities; tests/test_latent_semantic.py:208-220 covers fold-exchange aggregation; tests/test_latent_semantic.py:223-232 covers bound repeatability/target coverage. But docs/experiments/LATENT-001_contract.md:52-53 and 129-138 require target-free lambda selection and registered source-only decision criteria, while rg found no selection implementation beyond grid enumeration in src/ood_repr_reg/run_latent_audit.py:65-67 and no tests asserting target-free lambda selection. A read-only pytest attempt could not start because Python reported no usable temporary directory, so there is also no live passing test-run evidence from this audit."}],"blocking_actions":["Stop LATENT-001 continuation at CODE_GATE unless the experiment is re-registered or the supervisor protocol is explicitly reset; this is a second CODE_GATE failure after REVISE_ONCE.","To make a future registered attempt auditable, implement an explicit source-only lambda-selection/decision-rule path or narrow the frozen contract through the required gate process before re-auditing.","Add tests proving lambda selection uses only source risk plus the method source objective and cannot inspect target risk, target moments, target labels, semantic labels derived from targets, or evaluated-target bound tightness."]}