{"gate":"CODE_GATE","verdict":"REVISE_ONCE","summary":"The implementation mostly respects the CODE_GATE data-flow and accounting constraints: training, whitening, semantic estimation, bounds, and target risk evaluation are separated in src/ood_repr_reg/run_latent_audit.py and src/ood_repr_reg/latent_semantic.py. However, the gate cannot PASS because the test suite does not cover all frozen-contract requirements, and a bounded test/implementation audit repair is needed before continuation.","checks":[{"criterion":"1. Implemented objectives match their declared definitions.","status":"PASS","evidence":"docs/experiments/LATENT-001_contract.md:63-70 declares source MSE plus lambda-weighted L1/L2, scalar-scale IRMv1, Gaussian-RBF MMD, CORAL, shared-head gradient alignment, and shared-head Hessian alignment. src/ood_repr_reg/latent_semantic.py:315-355 implements those method branches, and src/ood_repr_reg/latent_semantic.py:358-394 trains with objective = mean_source_risk + strength * penalty."},{"criterion":"2. Target data cannot flow into training, lambda choice, whitening, operators, projectors, or semantic labels.","status":"PASS","evidence":"src/ood_repr_reg/run_latent_audit.py:45-84 builds sources and targets separately, samples train_batches and semantic_a/semantic_b only from sources, calls train_model only on train_batches, and calls fit_semantic_decomposition only on semantic_a/semantic_b. src/ood_repr_reg/latent_semantic.py:397-410 whitens only the encoded estimator batches passed in, src/ood_repr_reg/latent_semantic.py:459-484 estimates semantic raw bases from batch environment designs and source moments, and target_environments are used only after decomposition in src/ood_repr_reg/run_latent_audit.py:129-143 for risk output rows."},{"criterion":"3. ERM pairing uses the same seed/data/capacity and target risk is evaluated without retraining.","status":"PASS","evidence":"src/ood_repr_reg/run_latent_audit.py:57-77 creates one seed-specific source dataset, iterates latent_dim/method/lambda, and initializes every model with the same seed for a given capacity. ERM uses strengths [0.0] at src/ood_repr_reg/run_latent_audit.py:65-67, so regularized runs can be paired to same seed and latent_dim. Target risk accounting occurs after training/decomposition via component_risk_accounting at src/ood_repr_reg/run_latent_audit.py:129-143; component_risk_accounting in src/ood_repr_reg/latent_semantic.py:667-716 only evaluates moments with a fixed model and decomposition and does not retrain."},{"criterion":"4. Bound budgets are configured independently of evaluated targets.","status":"PASS","evidence":"configs/latent_001_main.json:11-15 preconfigures relation, mean, and covariance intervention_budget values. src/ood_repr_reg/run_latent_audit.py:126-128 computes conservative_component_bound before iterating over targets, using scm, sources, decomposition, and config budgets. src/ood_repr_reg/latent_semantic.py:719-764 computes the bound from SCM/source quantities and budget arguments and returns NO OMEGA-TO-COMPONENT BOUND rather than fitting an Omega bridge to evaluated targets."},{"criterion":"5. Tests cover all requirements in the frozen contract.","status":"FAIL","evidence":"tests/test_latent_semantic.py:35-139 covers source design, population moments, projector validity, partial semantic recovery/permutation, risk accounting closure, regularizer finiteness, MMD symmetry, reparameterization preservation, and absence of target arguments to fit_semantic_decomposition. It does not cover the runner-level source-only dataflow, same-seed/same-data/same-capacity ERM pairing, target-free lambda-selection discipline, independently configured bound budgets, the frozen A/B exchange-and-aggregate requirement in docs/experiments/LATENT-001_contract.md:84-88, or all declared objective formulas as numeric identities. A read-only pytest attempt also could not execute because the sandbox had no usable temporary directory, so no passing test run is available as executable evidence."}],"blocking_actions":["Add focused tests for run_latent_audit dataflow proving train_model and fit_semantic_decomposition receive only source batches while target environments are used only after models/projectors are frozen.","Add tests that ERM and each regularized run share seed-specific source data, model capacity, optimizer configuration, and initialization seed, and that target risk evaluation does not call train_model again.","Add objective identity tests for L1, L2, scalar-scale IRMv1, Gaussian-RBF MMD, CORAL, gradient alignment, and Hessian alignment against small hand-computable batches.","Add tests that intervention budgets come only from config/SCM limits and are not inferred from evaluated targets; include a guard that changing target cases does not change conservative_component_bound for a fixed model/decomposition.","Either implement and test the frozen A/B exchanged-and-aggregated semantic estimator, or explicitly amend the frozen contract through the required gate process before continuing."]}